{"$schema":"https://json-schema.org/draft/2020-12/schema","$id":"urn:vibemind:shared:contracts:research-plan:v1","title":"ResearchPlanV1","type":"object","additionalProperties":false,"required":["contract_version","plan_id","request_id","task_id","trace_id","collection_limits","budget"],"properties":{"contract_version":{"const":"v1"},"plan_id":{"$ref":"#/$defs/planId"},"request_id":{"$ref":"#/$defs/requestId"},"task_id":{"$ref":"#/$defs/taskId"},"trace_id":{"$ref":"#/$defs/traceId"},"collection_limits":{"$ref":"#/$defs/limits"},"budget":{"$ref":"#/$defs/budget"}},"$defs":{"planId":{"type":"string","pattern":"^plan_v1_[0-9A-HJKMNPQRSTVWXYZ]{26}$"},"requestId":{"type":"string","pattern":"^request_v1_[0-9A-HJKMNPQRSTVWXYZ]{26}$"},"taskId":{"type":"string","pattern":"^task_v1_[0-9A-HJKMNPQRSTVWXYZ]{26}$"},"traceId":{"type":"string","pattern":"^trace_v1_[0-9A-HJKMNPQRSTVWXYZ]{26}$"},"quoteId":{"type":"string","pattern":"^quote_v1_[0-9A-HJKMNPQRSTVWXYZ]{26}$"},"approvalId":{"type":"string","pattern":"^approval_v1_[0-9A-HJKMNPQRSTVWXYZ]{26}$"},"limits":{"type":"object","additionalProperties":false,"required":["max_sources","max_depth","max_duration_seconds"],"properties":{"max_sources":{"type":"integer","minimum":1,"maximum":50},"max_depth":{"type":"integer","minimum":1,"maximum":5},"max_duration_seconds":{"type":"integer","minimum":1,"maximum":3600}}},"budget":{"type":"object","additionalProperties":false,"required":["currency","max_cost_minor","quote_ref","approval_ref"],"properties":{"currency":{"type":"string","pattern":"^[A-Z]{3}$"},"max_cost_minor":{"type":"integer","minimum":0,"maximum":100000000},"quote_ref":{"$ref":"#/$defs/quoteId"},"approval_ref":{"$ref":"#/$defs/approvalId"}}}}}
