{
  "contract_version": "v1",
  "plan_id": "plan_v1_01J8Q3Z4R5T6V7W8X9Y0ABCDEF",
  "request_id": "request_v1_01J8Q3Z4R5T6V7W8X9Y0ABCDEF",
  "task_id": "task_v1_01J8Q3Z4R5T6V7W8X9Y0ABCDEF",
  "trace_id": "trace_v1_01J8Q3Z4R5T6V7W8X9Y0ABCDEF",
  "collection_limits": {"max_sources": 5, "max_depth": 1, "max_duration_seconds": 120},
  "budget": {"currency": "EUR", "max_cost_minor": 500, "quote_ref": "quote_v1_01J8Q3Z4R5T6V7W8X9Y0ABCDEF", "approval_ref": "approval_v1_01J8Q3Z4R5T6V7W8X9Y0ABCDEF"}
}
